Q25   Malformacoes congen das grandes arterias;2;0;0;0;0;0;0;0;0;0;0;0;0;0;0;0;0;0;0;0;0;0;2
Q33   Malformacoes congen do pulmao;1;0;0;0;0;0;0;0;0;0;0;0;0;0;0;0;0;0;0;0;0;0;1
Q61   Doenc cisticas do rim;2;0;0;0;0;0;0;0;0;0;0;0;0;0;0;0;0;0;0;0;0;0;2
Q87   Outr sindr c/malform cong q acomet mult sist;1;0;0;0;0;0;0;0;0;0;0;0;0;0;0;0;0;0;0;0;0;0;1
Q89   Outr malformacoes congen NCOP;1;0;0;0;0;0;0;0;0;0;0;0;0;0;0;0;0;0;0;0;0;0;1
Q90   Sindr de Down;0;0;0;0;0;0;0;1;0;0;0;0;0;0;0;0;0;0;0;0;0;0;1
Q91   Sindr de Edwards e sindr de Patau;2;0;0;0;0;0;0;0;0;0;0;0;0;0;0;0;0;0;0;0;0;0;2
Q99   Outr anomalias dos cromossomos NCOP;0;0;1;0;0;0;0;0;0;0;0;0;0;0;0;0;0;0;0;0;0;0;1
R09   Outr sint sinais relat ap circulat respirat;0;0;0;0;0;0;0;0;0;0;0;0;0;0;0;0;0;1;0;0;0;0;1
R54   Senilidade;0;0;0;0;0;0;0;0;0;0;0;0;0;0;1;1;1;4;1;3;0;0;11
R64   Caquexia;0;0;0;0;0;0;0;0;0;0;0;0;0;0;0;0;1;0;0;0;0;0;1
R68   Outr sint e sinais gerais;0;0;0;0;0;0;0;0;0;0;0;0;1;0;1;0;0;0;1;0;0;0;3
R96   Outr mortes subitas de causa desconhecida;0;0;0;0;0;0;0;1;1;0;0;0;0;1;0;1;0;0;0;0;0;0;4
R98   Morte s/assist;0;0;0;0;0;0;0;1;1;0;0;0;0;0;1;0;0;0;0;0;0;0;3
R99   Outr causas mal definidas e NE mortalidade;3;0;0;0;1;0;1;2;1;2;1;2;3;1;1;2;1;2;0;1;0;0;24
V02   Pedestre traum colis veic motor 2 3 rodas;0;0;0;0;0;0;0;1;0;0;0;0;0;0;0;0;0;0;0;0;0;0;1
V03   Pedestre traum colis automov pickup caminhon;0;0;0;0;1;0;0;0;0;0;0;0;0;0;0;0;0;0;0;0;0;0;1
V04   Pedestre traum colis veic transp pesado onib;0;0;0;0;0;1;0;0;0;0;0;0;0;0;0;0;0;0;0;0;0;0;1
V05   Pedestre traum colis trem veic ferroviario;0;0;0;0;0;0;0;1;0;0;0;0;0;1;0;0;0;0;0;0;0;0;2
V09   Pedestre traum outr acid transp e NE;0;0;0;1;5;2;1;1;4;8;0;1;2;3;0;3;1;1;0;0;0;0;33
V18   Ciclista traum acid transp s/colis;0;0;0;0;0;0;0;0;0;0;0;1;0;0;0;0;0;0;0;0;0;0;1
V19   Ciclista traum acid transp e NE;0;0;0;0;0;0;0;2;0;1;0;0;1;1;0;0;0;0;0;0;0;0;5
V23   Motocicl traum colis automov pickup caminhon;0;0;0;0;0;1;1;0;0;1;0;0;0;0;0;0;0;0;0;0;0;0;3
V24   Motocicl traum colis veic transp pesado onib;0;0;0;0;0;0;0;1;0;0;2;0;0;0;0;0;0;0;0;0;0;0;3
V27   Motocicl traum colis objeto fixo parado;0;0;0;0;1;1;2;0;1;0;0;0;0;0;0;0;0;0;0;0;0;0;5
V29   Motociclista traum outr acid transp e NE;0;0;0;2;10;6;4;5;3;0;4;0;0;0;0;0;0;0;0;0;0;0;34
V43   Ocup automov traum col auto pickup caminhon;0;0;0;0;0;0;0;0;0;0;0;1;0;0;0;0;0;0;0;0;0;0;1
V44   Ocup autom traum colis veic trans pesad onib;0;0;0;0;0;0;0;0;0;0;0;0;0;1;0;0;0;0;0;0;0;0;1
V47   Ocup automovel traum colis obj fixo parado;0;0;0;0;0;1;1;0;0;1;0;1;0;0;0;0;0;0;0;0;0;0;4
V48   Ocup automovel traum acid transp s/colis;0;0;0;1;0;0;0;0;1;0;0;0;0;0;0;0;0;0;0;0;0;0;2
V49   Ocup automovel traum outr acid transp e NE;0;0;0;0;1;1;1;0;0;2;0;1;0;0;0;0;0;0;0;0;0;0;6
V54   Ocup caminhon traum col veic transp pes onib;0;0;1;0;0;0;0;0;0;0;0;0;0;0;0;0;0;0;0;0;0;0;1
V57   Ocup caminhonete traum colis obj fixo parado;0;0;0;0;0;0;0;1;0;0;0;0;0;0;0;0;0;0;0;0;0;0;1
V64   Ocup v tr pes tr col outr veic tr pes onib;0;0;0;0;0;1;0;0;0;0;0;0;0;0;0;0;0;0;0;0;0;0;1
V87   Acid trans tipo espec desconh mod transp vit;0;0;0;0;0;0;1;0;0;1;0;0;0;0;0;0;0;0;0;0;0;0;2
V89   Acid veic mot n-mot tipos de veic NE;0;0;0;2;3;1;1;1;1;3;0;1;1;1;0;0;0;0;0;0;0;0;15
V99   Acid transp NE;0;0;0;0;0;0;0;1;0;0;0;0;0;0;0;0;0;0;0;0;0;0;1
W06   Queda de um leito;0;0;0;0;0;0;0;0;0;0;1;0;0;0;0;0;0;0;0;0;0;0;1
W10   Queda em ou de escadas ou degraus;0;0;0;0;0;0;0;0;0;0;0;0;0;0;0;0;1;0;0;0;0;0;1
W13   Queda de ou p/fora edificios outr estruturas;0;0;0;0;0;0;0;0;0;0;0;0;0;0;1;0;0;0;0;0;0;0;1
W14   Queda de arvore;0;0;0;0;0;0;0;0;0;0;1;0;0;0;0;0;0;0;0;0;0;0;1
W17   Outr quedas de um nivel a outr;0;0;0;0;0;0;0;0;0;1;0;0;1;0;1;1;0;1;0;0;0;0;5
W18   Outr quedas no mesmo nivel;0;0;1;0;0;0;0;0;0;0;2;3;1;0;5;3;4;2;3;2;0;0;26
W19   Queda s/especificacao;0;0;1;0;0;0;0;0;2;0;2;1;6;0;0;5;11;10;7;1;0;0;46
W20   Impacto caus objeto lanc projetado em queda;0;0;0;0;0;0;0;1;0;1;0;0;0;0;0;0;0;0;0;0;0;0;2
W31   Contato c/outr maquinas e c/as NE;0;0;0;0;0;0;0;0;0;0;0;0;0;0;1;0;0;0;0;0;0;0;1
W34   Projeteis de outr armas de fogo e das NE;0;0;0;0;0;0;0;1;0;0;0;0;0;0;0;0;0;0;0;0;0;0;1
W69   Afogamento e submersao em aguas naturais;0;0;0;1;0;0;0;0;0;0;0;2;1;1;0;0;0;0;0;0;0;0;5
W74   Afogamento e submersao NE;1;0;0;2;1;1;0;0;0;1;0;1;0;0;0;0;0;0;0;0;0;0;7
W78   Inalacao do conteudo gastrico;1;0;0;0;0;0;0;0;0;0;0;0;0;0;1;0;0;0;0;0;0;0;2
W79   Inalacao ingest aliment caus obstr trat resp;2;0;0;0;0;0;0;0;0;0;0;0;0;0;0;0;0;0;0;0;0;0;2
W80   Inalac ingest outr obj caus obstr trat resp;1;0;0;0;0;0;0;0;0;0;0;1;0;1;0;0;0;0;0;0;0;0;3
W87   Exposicao a corrente eletrica NE;0;0;0;0;1;0;0;0;0;0;0;0;0;0;0;0;0;0;0;0;0;0;1
X02   Exposicao fogo contr edif outr tipo constr;0;0;0;0;0;0;0;0;0;0;0;0;1;0;0;0;0;0;0;0;0;0;1
X03   Expos fogo contr fora edif outr tipo constr;0;0;0;0;0;0;1;0;0;0;0;0;0;0;0;0;0;0;0;0;0;0;1
X04   Exposicao combustao subst muito inflamavel;0;0;0;0;0;0;0;0;0;0;0;1;0;0;0;0;0;0;0;0;0;0;1
X09   Exposicao a tipo NE de fumaca fogo chamas;0;0;0;0;0;0;1;0;2;2;0;0;1;1;0;0;0;0;0;0;0;0;7
X19   Contato outr fontes calor subst quentes NE;0;0;0;0;0;0;0;0;0;0;0;0;0;0;1;0;0;0;0;0;0;0;1
X44   Envenen acid outr drog medic subst biolog NE;0;0;0;0;0;0;0;0;0;0;1;0;0;0;0;0;0;0;0;0;0;0;1
X59   Exposicao a fatores NE;0;0;0;0;0;0;0;0;0;0;2;1;1;0;1;0;0;0;0;0;0;0;5
X64   Auto-int intenc out drog med subst biolog NE;0;0;0;0;0;0;1;0;0;0;0;0;0;0;0;0;0;0;0;0;0;0;1
X67   Auto-intox intenc p/outr gases e vapores;0;0;0;0;1;0;0;0;0;0;0;0;0;0;0;0;0;0;0;0;0;0;1
X68   Auto-intox intenc a pesticidas;0;0;0;0;0;1;0;0;0;0;0;0;1;0;0;0;0;0;0;0;0;0;2
X69   Auto-int intenc outr prod quim subst noc NE;0;0;0;0;0;0;0;1;0;0;0;0;0;0;0;0;0;0;0;0;0;0;1
X70   Lesao autoprov intenc enforc estrang sufoc;0;0;2;0;6;8;5;5;4;2;2;3;3;4;2;1;0;0;1;0;0;0;48
X72   Lesao autoprov intenc disp arma fogo de mao;0;0;0;0;0;0;0;0;1;0;0;0;0;0;0;0;0;0;0;0;0;0;1
X74   Lesao autopr intenc disp outr arma fogo e NE;0;0;0;0;0;0;0;0;3;0;1;0;0;0;1;0;0;0;0;0;0;0;5
X79   Lesao autoprov intenc p/objeto contundente;0;0;0;0;0;0;0;1;0;0;0;0;0;0;0;0;0;0;0;0;0;0;1
X80   Lesao autoprov intenc precip lugar elevado;0;0;0;0;1;0;2;0;1;0;0;0;0;1;1;1;0;0;0;0;0;0;7
X84   Lesao autoprov intenc p/meios NE;0;0;0;0;1;1;0;0;1;0;0;0;0;0;0;0;0;0;0;0;0;0;3
X91   Agressao enforc estrangulamento sufocacao;0;0;0;0;0;0;0;0;1;0;0;1;0;0;0;0;0;0;0;0;0;0;2
X93   Agressao disparo de arma de fogo de mao;0;0;0;0;0;1;0;0;0;0;0;0;0;0;0;0;0;0;0;0;0;0;1
X95   Agressao disparo outr arma de fogo ou NE;0;0;0;5;12;24;11;8;7;7;3;2;3;1;0;0;0;1;0;0;0;0;84
X99   Agressao objeto cortante ou penetrante;0;0;0;0;0;6;5;1;2;2;2;2;1;0;0;0;0;0;0;0;0;0;21
Y00   Agressao p/meio de um objeto contundente;0;0;0;0;0;2;0;0;2;1;4;0;1;0;0;0;0;0;0;0;0;0;10
Y09   Agressao p/meios NE;0;0;0;0;0;0;1;1;0;1;0;1;0;0;0;0;0;0;0;0;0;0;4
Y12   Envenen narcot psicodislept NCOP int n det;0;0;0;0;0;0;0;1;0;0;0;0;0;0;0;0;0;0;0;0;0;0;1
Y14   Env out drog med subst biolog e NE int n det;0;0;0;0;0;0;0;0;1;0;0;0;0;0;0;0;0;0;0;0;0;0;1
Y15   Envenen alcool intencao nao determinada;0;0;0;0;0;0;0;0;0;0;0;0;0;0;0;0;1;0;0;0;0;0;1
Y19   Env out prod quim subst noc e NE int n det;0;0;0;0;0;1;0;0;1;0;0;0;0;0;0;0;0;0;0;0;0;0;2
Y21   Afogamento submersao intenc nao determinada;0;0;0;0;0;0;0;0;0;0;1;0;0;0;0;0;0;0;0;0;0;0;1
Y29   Contato obj contundente intenc n det;0;0;0;0;2;2;3;1;2;3;2;2;5;1;0;0;0;0;0;0;0;1;24
Y34   Fatos ou eventos NE e intenc nao determinada;1;0;1;0;1;4;2;6;3;8;3;2;4;5;2;2;0;0;1;0;0;5;50
Y85   Sequelas de acid transp;0;0;0;0;0;0;0;1;0;0;0;0;0;0;0;0;0;0;0;0;0;0;1
Y87   Seq lesao autopr inten agress fato int indet;0;0;0;0;0;0;0;1;0;0;0;0;0;0;0;0;0;0;0;0;0;0;1
Y88   Sequelas cuid med cirurg consid causa ext;0;0;0;0;0;0;0;0;0;1;0;0;0;0;0;0;0;0;0;0;0;0;1
Y89   Sequelas de outr causas externas;0;0;0;0;0;0;0;0;1;1;0;4;0;0;0;0;1;0;0;0;0;0;7
Total;82;8;10;31;60;87;83;108;137;185;218;355;447;492;511;525;547;460;315;101;19;8;4789
