 Mortalidade - Brasil;;;;;;;;;;;;;;;;;;;;;;
Y06   Negligencia e abandono;-;-;-;-;-;-;-;-;-;-;-;-;-;-;-;1;1;-;-;-;-;2
Y07   Outr sindr de maus tratos;-;-;1;2;-;-;-;-;-;-;1;-;-;-;-;-;-;-;-;-;-;4
Y08   Agressao p/outr meios espec;-;-;-;-;-;-;1;-;-;-;1;1;-;-;-;-;-;1;-;-;-;4
Y09   Agressao p/meios NE;-;-;-;-;1;-;1;1;-;1;1;3;3;-;2;-;1;1;1;-;-;16
Y10   Env analg antipir antireum n-opiac int n det;-;-;-;-;-;-;-;-;-;1;-;-;-;-;-;-;-;-;-;-;-;1
Y11   Env antic sed hipn antip psic NCOP int n det;-;-;-;-;-;-;-;2;-;1;1;1;-;-;-;-;-;-;-;-;-;5
Y12   Envenen narcot psicodislept NCOP int n det;-;-;-;-;-;-;-;2;-;-;1;1;-;-;-;-;-;-;-;-;-;4
Y13   Env out subst farm sist nerv auton int n det;-;-;-;-;-;-;-;-;-;-;-;-;-;-;-;-;-;-;1;1;-;2
Y14   Env out drog med subst biolog e NE int n det;-;-;-;-;-;1;-;2;1;-;-;-;-;-;2;-;1;-;-;-;-;7
Y15   Envenen alcool intencao nao determinada;-;-;-;-;-;-;-;-;-;-;-;-;1;-;-;1;-;-;-;-;-;2
Y18   Envenen pesticidas intencao nao determinada;-;-;-;-;-;-;-;-;-;-;-;-;-;-;1;-;-;-;-;-;-;1
Y19   Env out prod quim subst noc e NE int n det;-;-;-;-;-;-;2;-;2;3;3;1;3;1;1;-;-;2;-;-;-;18
Y20   Enforc estrang sufoc intenc nao determinada;1;-;2;-;-;2;8;8;4;6;8;4;6;3;3;2;3;-;2;2;-;64
Y21   Afogamento submersao intenc nao determinada;-;-;-;-;1;-;1;-;-;2;2;-;-;4;1;-;-;-;-;-;-;11
Y24   Disparo outr arma fogo e NE intenc nao det;-;-;-;-;1;-;1;2;2;1;2;3;1;3;-;-;-;1;1;2;-;20
Y26   Exposicao fumaca fogo chamas intenc n det;-;-;-;-;-;-;-;-;-;-;2;1;1;-;-;1;-;-;-;1;-;6
Y28   Contato obj cortante penetrante intenc n det;-;-;-;-;-;-;1;7;3;4;3;-;3;2;3;-;1;-;3;1;-;31
Y29   Contato obj contundente intenc n det;-;-;-;4;2;2;5;6;6;10;12;12;6;8;6;11;15;15;31;124;2;277
Y30   Queda salto empurr lugar elev intenc n det;-;-;-;-;-;-;-;-;1;1;1;-;-;1;-;3;1;-;1;8;-;17
Y32   Impacto veic a motor intenc nao determinada;-;-;-;-;-;-;-;-;-;-;-;1;-;-;-;-;-;-;-;-;-;1
Y33   Outr fatos ou eventos espec intenc n det;-;-;-;-;-;-;-;-;-;1;-;-;-;-;-;1;-;-;-;1;-;3
Y34   Fatos ou eventos NE e intenc nao determinada;1;-;4;1;1;1;4;12;7;18;12;15;7;17;16;21;32;25;32;176;3;405
Y35   Intervencao legal;-;-;-;-;-;-;-;1;-;-;1;-;-;-;-;-;-;-;-;-;-;2
Y43   Subst de acao prim sistemica;-;-;-;-;-;-;-;-;-;-;-;-;1;-;-;-;-;2;-;-;-;3
Y44   Subst farm atuam prim s/constit sangue;-;-;-;-;-;-;-;-;-;-;-;-;1;-;-;1;1;1;1;2;-;7
Y45   Subst analges antipiret e antiinflamatorias;-;-;-;-;-;-;-;-;-;-;-;-;-;-;-;-;1;-;-;-;-;1
Y48   Anestesicos e gases terapeuticos;-;-;-;-;-;-;-;-;-;-;-;-;1;-;-;-;-;-;-;-;-;1
Y57   Outr drogas e medicamentos e as NE;-;-;-;-;-;-;-;1;-;-;-;-;-;-;-;-;-;-;1;-;-;2
Y60   Cort punc perf hemorr acid cuid med cirurg;-;-;-;-;-;-;-;-;1;1;-;-;-;-;-;-;-;-;-;-;-;2
Y65   Outr acid durante prest cuid medic cirurg;-;-;-;-;-;-;-;-;-;-;-;-;-;-;-;-;-;-;-;1;-;1
Y73   Disp usados gastroent urolog assoc incid adv;-;-;-;-;-;-;-;-;-;-;-;-;-;-;-;-;-;1;-;-;-;1
Y83   Reac anorm compl tard interv cirurg s/acid;-;-;1;-;-;1;1;2;-;1;3;6;5;5;14;14;17;17;24;68;-;179
Y84   Reac anorm compl tard out proc med s/acid;-;-;-;-;-;-;-;-;1;-;-;-;1;1;1;-;2;3;2;7;-;18
Y85   Sequelas de acid transp;-;-;-;-;-;-;-;-;-;-;-;-;-;-;-;-;-;-;-;1;-;1
Y86   Sequelas de outr acid;-;-;-;1;-;-;-;-;-;-;-;-;-;-;-;-;-;1;-;3;-;5
Y87   Seq lesao autopr inten agress fato int indet;-;-;-;-;-;-;-;-;-;-;-;-;-;-;-;-;1;-;-;2;-;3
Y88   Sequelas cuid med cirurg consid causa ext;-;-;-;-;-;-;-;-;-;1;-;-;2;-;1;3;3;2;-;2;-;14
Y89   Sequelas de outr causas externas;-;-;-;-;-;-;-;1;1;-;-;1;-;-;1;-;-;2;2;2;-;10
Total;1400;633;856;440;223;259;597;898;1010;1456;2030;2930;3846;5372;7753;10437;12708;14136;16070;58360;49;141463
 Fonte: MS/SVS/CGIAE - Sistema de Informações sobre Mortalidade - SIM;;;;;;;;;;;;;;;;;;;;;;
 Nota:;;;;;;;;;;;;;;;;;;;;;;
 ;;;;;;;;;;;;;;;;;;;;;;
 Em 2011, houve uma mudança no conteúdo da Declaração de Óbito, com maior detalhamento das informações coletadas. Para este ano, foram;;;;;;;;;;;;;;;;;;;;;;
 utilizados simultaneamente os dois formulários. Para mais detalhes sobre as mudanças ocorridas e os seus efeitos, veja o documento;;;;;;;;;;;;;;;;;;;;;;
" ""Sistema de Informações sobre Mortalidade - SIM. Consolidação da base de dados de 2011"".";;;;;;;;;;;;;;;;;;;;;;
 No dia 13/06/2019, os arquivos do SIM referentes ao ano de notificação 2017 foram atualizados, com alteração das causas básicas de 2 registros e exclusão de 1 registro.;;;;;;;;;;;;;;;;;;;;;;
 No dia 01/04/2020, os arquivos do SIM referentes ao ano de notificação 2019 foram atualizados, com alteração das causas básicas de 4 registros e exclusão de 1 registro.;;;;;;;;;;;;;;;;;;;;;;
 ;;;;;;;;;;;;;;;;;;;;;;
